{
  "calendar_id": "cme-equity-index",
  "content_sha256": "382c3d50abc9d5e0b95c45f1a8c182f9cf2042bc9dcf31a5a98128c59401e39e",
  "effective_from": "2026-09-11T00:00:00Z",
  "effective_until": "2028-12-31T23:59:59Z",
  "generated_at": "2026-09-12T04:40:00Z",
  "guard_windows": [
    {"end":"2026-11-29T00:00:00-06:00","holiday_name":"Thanksgiving 2026","policy":"FAIL_CLOSED_FOR_NEW_RISK","source_note":"CME published holiday window; exact MES/MNQ intraday events not imported","start":"2026-11-26T00:00:00-06:00","verification":"UNVERIFIED"},
    {"end":"2026-12-27T00:00:00-06:00","holiday_name":"Christmas 2026","policy":"FAIL_CLOSED_FOR_NEW_RISK","source_note":"CME published holiday window; exact MES/MNQ intraday events not imported","start":"2026-12-24T00:00:00-06:00","verification":"UNVERIFIED"},
    {"end":"2027-01-02T00:00:00-06:00","holiday_name":"New Year's 2027","policy":"FAIL_CLOSED_FOR_NEW_RISK","source_note":"CME published holiday window; exact MES/MNQ intraday events not imported","start":"2026-12-31T00:00:00-06:00","verification":"UNVERIFIED"},
    {"end":"2027-01-20T00:00:00-06:00","holiday_name":"MLK Day 2027","policy":"FAIL_CLOSED_FOR_NEW_RISK","source_note":"CME 2027 holiday notes; exact MES/MNQ intraday events not imported","start":"2027-01-17T00:00:00-06:00","verification":"UNVERIFIED"},
    {"end":"2027-02-17T00:00:00-06:00","holiday_name":"Presidents Day 2027","policy":"FAIL_CLOSED_FOR_NEW_RISK","source_note":"CME 2027 holiday notes; exact MES/MNQ intraday events not imported","start":"2027-02-14T00:00:00-06:00","verification":"UNVERIFIED"},
    {"end":"2027-03-28T00:00:00-05:00","holiday_name":"Good Friday 2027","policy":"FAIL_CLOSED_FOR_NEW_RISK","source_note":"CME holiday notes identify no Friday Mar 26 trade date","start":"2027-03-25T00:00:00-05:00","verification":"UNVERIFIED"},
    {"end":"2027-06-02T00:00:00-05:00","holiday_name":"Memorial Day 2027","policy":"FAIL_CLOSED_FOR_NEW_RISK","source_note":"CME 2027 holiday notes; exact MES/MNQ intraday events not imported","start":"2027-05-30T00:00:00-05:00","verification":"UNVERIFIED"},
    {"end":"2027-06-20T00:00:00-05:00","holiday_name":"Juneteenth 2027","policy":"FAIL_CLOSED_FOR_NEW_RISK","source_note":"CME 2027 holiday notes; exact MES/MNQ intraday events not imported","start":"2027-06-17T00:00:00-05:00","verification":"UNVERIFIED"},
    {"end":"2027-07-07T00:00:00-05:00","holiday_name":"Independence Day 2027","policy":"FAIL_CLOSED_FOR_NEW_RISK","source_note":"CME 2027 holiday notes; exact MES/MNQ intraday events not imported","start":"2027-07-04T00:00:00-05:00","verification":"UNVERIFIED"},
    {"end":"2027-09-08T00:00:00-05:00","holiday_name":"Labor Day 2027","policy":"FAIL_CLOSED_FOR_NEW_RISK","source_note":"CME 2027 holiday notes; exact MES/MNQ intraday events not imported","start":"2027-09-05T00:00:00-05:00","verification":"UNVERIFIED"},
    {"end":"2027-11-28T00:00:00-06:00","holiday_name":"Thanksgiving 2027","policy":"FAIL_CLOSED_FOR_NEW_RISK","source_note":"CME 2027 holiday notes; exact MES/MNQ intraday events not imported","start":"2027-11-24T00:00:00-06:00","verification":"UNVERIFIED"},
    {"end":"2027-12-27T00:00:00-06:00","holiday_name":"Christmas 2027","policy":"FAIL_CLOSED_FOR_NEW_RISK","source_note":"CME 2027 holiday notes; exact MES/MNQ intraday events not imported","start":"2027-12-22T00:00:00-06:00","verification":"UNVERIFIED"},
    {"end":"2028-01-03T00:00:00-06:00","holiday_name":"New Year's 2028","policy":"FAIL_CLOSED_FOR_NEW_RISK","source_note":"Candidate guard; authoritative intraday schedule not imported","start":"2027-12-30T00:00:00-06:00","verification":"UNVERIFIED"},
    {"end":"2028-01-19T00:00:00-06:00","holiday_name":"MLK Day 2028","policy":"FAIL_CLOSED_FOR_NEW_RISK","source_note":"Candidate guard; authoritative CME schedule not yet available","start":"2028-01-16T00:00:00-06:00","verification":"UNVERIFIED"},
    {"end":"2028-02-23T00:00:00-06:00","holiday_name":"Presidents Day 2028","policy":"FAIL_CLOSED_FOR_NEW_RISK","source_note":"Candidate guard; authoritative CME schedule not yet available","start":"2028-02-20T00:00:00-06:00","verification":"UNVERIFIED"},
    {"end":"2028-04-16T00:00:00-05:00","holiday_name":"Good Friday 2028","policy":"FAIL_CLOSED_FOR_NEW_RISK","source_note":"Candidate guard; authoritative CME schedule not yet available","start":"2028-04-13T00:00:00-05:00","verification":"UNVERIFIED"},
    {"end":"2028-05-31T00:00:00-05:00","holiday_name":"Memorial Day 2028","policy":"FAIL_CLOSED_FOR_NEW_RISK","source_note":"Candidate guard; authoritative CME schedule not yet available","start":"2028-05-28T00:00:00-05:00","verification":"UNVERIFIED"},
    {"end":"2028-06-21T00:00:00-05:00","holiday_name":"Juneteenth 2028","policy":"FAIL_CLOSED_FOR_NEW_RISK","source_note":"Candidate guard; authoritative CME schedule not yet available","start":"2028-06-18T00:00:00-05:00","verification":"UNVERIFIED"},
    {"end":"2028-07-06T00:00:00-05:00","holiday_name":"Independence Day 2028","policy":"FAIL_CLOSED_FOR_NEW_RISK","source_note":"Candidate guard; authoritative CME schedule not yet available","start":"2028-07-03T00:00:00-05:00","verification":"UNVERIFIED"},
    {"end":"2028-09-06T00:00:00-05:00","holiday_name":"Labor Day 2028","policy":"FAIL_CLOSED_FOR_NEW_RISK","source_note":"Candidate guard; authoritative CME schedule not yet available","start":"2028-09-03T00:00:00-05:00","verification":"UNVERIFIED"},
    {"end":"2028-11-25T00:00:00-06:00","holiday_name":"Thanksgiving 2028","policy":"FAIL_CLOSED_FOR_NEW_RISK","source_note":"Candidate guard; authoritative CME schedule not yet available","start":"2028-11-22T00:00:00-06:00","verification":"UNVERIFIED"},
    {"end":"2028-12-27T00:00:00-06:00","holiday_name":"Christmas 2028","policy":"FAIL_CLOSED_FOR_NEW_RISK","source_note":"Candidate guard; authoritative CME schedule not yet available","start":"2028-12-24T00:00:00-06:00","verification":"UNVERIFIED"}
  ],
  "overrides": [],
  "products": ["MES", "MNQ"],
  "regular_week": {"daily_maintenance_end":"17:00:00","daily_maintenance_start":"16:00:00","friday_close":"16:00:00","sunday_open":"17:00:00"},
  "schema": "cme_market_calendar_v1",
  "source": {
    "authority": "CME Group",
    "notes": "CME publishes 2026/2027 holiday windows, but exact MES/MNQ intraday market events have not yet been imported from the authenticated Trading Schedules API. Holiday windows remain fail-closed guards until imported.",
    "published_calendar_through_year": 2027,
    "reference_data_api_url": "https://refdata.api.cmegroup.com/refdata/v3/tradingSchedules",
    "trading_hours_url": "https://www.cmegroup.com/trading-hours.html",
    "verified_through_year": 2025
  },
  "timezone": "America/Chicago",
  "venue": "CME_GLOBEX"
}
